{
  "$schema": "http://json-schema.org/draft-07/schema#",
  "title": "Vulnerability Dataset Entry",
  "type": "object",
  "required": ["vulnerability_id", "description", "affected_component", "dsgai_mapping", "severity", "date_reported"],
  "properties": {
    "vulnerability_id": { "type": "string", "pattern": "^VULN-\\d{4}$" },
    "description": { "type": "string", "minLength": 20 },
    "affected_component": { "type": "string", "enum": ["model", "rag_pipeline", "vector_store", "api", "plugin", "agent_framework", "training_pipeline", "observability", "other"] },
    "dsgai_mapping": { "type": "array", "items": { "type": "string", "pattern": "^DSGAI(0[1-9]|1[0-9]|2[01])$" }, "minItems": 1 },
    "llm_top10_mapping": { "type": "array", "items": { "type": "string" } },
    "severity": { "type": "string", "enum": ["Critical", "High", "Medium", "Low"] },
    "cvss_score": { "type": "number", "minimum": 0, "maximum": 10 },
    "cve_id": { "type": "string", "pattern": "^CVE-\\d{4}-\\d+$" },
    "cwe_id": { "type": "string", "pattern": "^CWE-\\d+$" },
    "source": { "type": "string" },
    "date_reported": { "type": "string", "format": "date" }
  }
}
