{
  "vulnerability_id": "VULN-0001",
  "description": "RAG pipeline returns verbatim PII from training documents when prompted with specific context-setting instructions followed by enumeration queries.",
  "affected_component": "rag_pipeline",
  "dsgai_mapping": ["DSGAI01"],
  "llm_top10_mapping": ["LLM06:2025"],
  "severity": "High",
  "cvss_score": 7.5,
  "source": "https://example.com/advisory/2025-001",
  "date_reported": "2025-06-15"
}
